{
  "meta": {
    "module": "src.common.content_node",
    "source": "src/common/content_node.zig",
    "language": "zig"
  },
  "capabilities": ["coral-database"],
  "used_by": ["src/common/root.zig"],
  "members": [
    {
      "type": "struct",
      "name": "ContentNode",
      "match_hash": "29805dc53dda5d3e5873331e0283b18f56b046ba83b5c229e5d90fb10ecd83d5",
      "signature": "keyword_struct ContentNode { ... }",
      "is_pub": true,
      "members": [
        {
          "type": "fn_decl",
          "name": "init",
          "match_hash": "370beca4c51f29b3a42875db206c6430a8cf4ba880aaa91706c895e734d5d0dd",
          "signature": "fn init(allocator: std.mem.Allocator, full_text: []const u8) -> ContentNode",
          "params": [
            { "name": "allocator", "type": "std.mem.Allocator" },
            { "name": "full_text", "type": "[]const u8" }
          ],
          "returns": "ContentNode",
          "is_pub": true,
          "line": 34
        },
        {
          "type": "fn_decl",
          "name": "getLod",
          "match_hash": "adf814e23cc0e95ea9cecce85cc30dc05847b5aec57a056f266686778ff18cac",
          "signature": "fn getLod(self: *const ContentNode, level: u3) -> []const u8",
          "params": [
            { "name": "self", "type": "*const ContentNode" },
            { "name": "level", "type": "u3" }
          ],
          "returns": "[]const u8",
          "is_pub": true,
          "line": 43
        },
        {
          "type": "fn_decl",
          "name": "setLod",
          "match_hash": "f61146128a7b9a0f4c8364e2cd4d52a5ad97ca505d2034f08e0b9e820ed7ec4d",
          "signature": "fn setLod(self: *ContentNode, level: u3, value: []const u8) -> void",
          "params": [
            { "name": "self", "type": "*ContentNode" },
            { "name": "level", "type": "u3" },
            { "name": "value", "type": "[]const u8" }
          ],
          "returns": "void",
          "is_pub": true,
          "line": 49
        },
        {
          "type": "fn_decl",
          "name": "setSource",
          "match_hash": "fd41ea9a85da1b5675a4d477524a83360477b07bc4e31d98a4e6c2d27d49d56c",
          "signature": "fn setSource(self: *ContentNode, allocator: std.mem.Allocator, text: []const u8) -> void",
          "params": [
            { "name": "self", "type": "*ContentNode" },
            { "name": "allocator", "type": "std.mem.Allocator" },
            { "name": "text", "type": "[]const u8" }
          ],
          "returns": "void",
          "is_pub": true,
          "line": 55
        },
        {
          "type": "fn_decl",
          "name": "clone",
          "match_hash": "fba36856e813b14a2a66e3c6a1d1ef2c534ef64a302015b44f0bf1c7934b0c96",
          "signature": "fn clone(self: *const ContentNode, allocator: std.mem.Allocator) -> ContentNode",
          "params": [
            { "name": "self", "type": "*const ContentNode" },
            { "name": "allocator", "type": "std.mem.Allocator" }
          ],
          "returns": "ContentNode",
          "is_pub": true,
          "line": 64
        },
        {
          "type": "fn_decl",
          "name": "free",
          "match_hash": "3c3baa46e6cf331f55a2e6e2ccde47e8d86cc230fa671898b0f2179ef1c744a1",
          "signature": "fn free(self: *ContentNode, allocator: std.mem.Allocator) -> void",
          "params": [
            { "name": "self", "type": "*ContentNode" },
            { "name": "allocator", "type": "std.mem.Allocator" }
          ],
          "returns": "void",
          "is_pub": true,
          "line": 89
        }
      ],
      "line": 24
    },
    {
      "type": "test_decl",
      "name": "ContentNode init and free",
      "is_pub": false,
      "line": 113
    },
    {
      "type": "test_decl",
      "name": "ContentNode setLod and getLod",
      "is_pub": false,
      "line": 122
    },
    {
      "type": "test_decl",
      "name": "ContentNode setSource",
      "is_pub": false,
      "line": 133
    },
    {
      "type": "test_decl",
      "name": "ContentNode clone",
      "is_pub": false,
      "line": 141
    }
  ]
}
