{
  "meta": {
    "module": "src.coral.mcp",
    "source": "src/coral/mcp.zig",
    "language": "zig"
  },
  "keywords": ["JSON-RPC", "Coral MCP", "STDIO", "QueueReactor", "Arena", "ContextNode", "Claude", "NullClaw", "Cursor"],
  "used_by": ["src/coral/main.zig"],
  "members": [
    {
      "type": "struct",
      "name": "ToolDef",
      "match_hash": "3ad24ce6f16488fa534fe36f7369d88f3931c123523bced498a992f5eb52995c",
      "signature": "keyword_struct ToolDef { ... }",
      "is_pub": true,
      "line": 21
    },
    {
      "type": "struct",
      "name": "JsonRpcRequest",
      "match_hash": "ba93b010fe244fd50407ae4876013cf1ea1d1fb14d3206945c93142d807b05be",
      "signature": "keyword_struct JsonRpcRequest { ... }",
      "is_pub": false,
      "line": 55
    },
    {
      "type": "struct",
      "name": "McpServer",
      "match_hash": "e6043e4781e4ac55df457ded001af893105e13c89e925e9a61066b1ab680245a",
      "signature": "keyword_struct McpServer { ... }",
      "is_pub": true,
      "members": [
        {
          "type": "fn_decl",
          "name": "serve",
          "match_hash": "443e491ffd1557f07ddc7085c62cdeabf7cb41910f854d8d6bf3f4c928f1dec1",
          "signature": "fn serve(self: *McpServer, reader: *std.Io.Reader, writer: *std.Io.Writer) -> void",
          "params": [
            { "name": "self", "type": "*McpServer" },
            { "name": "reader", "type": "*std.Io.Reader" },
            { "name": "writer", "type": "*std.Io.Writer" }
          ],
          "returns": "void",
          "is_pub": true,
          "line": 78
        }
    ,    {
          "type": "fn_decl",
          "name": "handleRequest",
          "match_hash": "80c4b8760e6b07cd87d34c1ca057b7572795bfa86d25fc9845b4d6af1d270e4c",
          "signature": "fn handleRequest(self: *McpServer, raw_json: []const u8) -> []const u8",
          "params": [
            { "name": "self", "type": "*McpServer" },
            { "name": "raw_json", "type": "[]const u8" }
          ],
          "returns": "[]const u8",
          "is_pub": true,
          "line": 122
        }
    ,    {
          "type": "fn_private",
          "name": "dispatch",
          "match_hash": "5100c6977d712144e98eff0260bbbc863dd4d0b7f2d5a4dbf961d2eedc790b45",
          "signature": "fn dispatch(self: *McpServer, a: std.mem.Allocator, req: JsonRpcRequest) -> []const u8",
          "params": [
            { "name": "self", "type": "*McpServer" },
            { "name": "a", "type": "std.mem.Allocator" },
            { "name": "req", "type": "JsonRpcRequest" }
          ],
          "returns": "[]const u8",
          "is_pub": false,
          "line": 141
        }
    ,    {
          "type": "fn_private",
          "name": "handleInitialize",
          "match_hash": "ae6270a448351f9aba1392771ee6bb49d97c4d99d7fbd007ef041b3f1a311ac3",
          "signature": "fn handleInitialize(self: *McpServer, a: std.mem.Allocator, req: JsonRpcRequest) -> []const u8",
          "params": [
            { "name": "self", "type": "*McpServer" },
            { "name": "a", "type": "std.mem.Allocator" },
            { "name": "req", "type": "JsonRpcRequest" }
          ],
          "returns": "[]const u8",
          "is_pub": false,
          "line": 154
        }
    ,    {
          "type": "fn_private",
          "name": "handleToolsList",
          "match_hash": "e7e41b3318f222ae55985b1bf405ef40af5f5e58f2761f0e5358a469d6e57f57",
          "signature": "fn handleToolsList(self: *McpServer, a: std.mem.Allocator, req: JsonRpcRequest) -> []const u8",
          "params": [
            { "name": "self", "type": "*McpServer" },
            { "name": "a", "type": "std.mem.Allocator" },
            { "name": "req", "type": "JsonRpcRequest" }
          ],
          "returns": "[]const u8",
          "is_pub": false,
          "line": 169
        }
    ,    {
          "type": "fn_private",
          "name": "handleToolsCall",
          "match_hash": "137febeba3ab2c1edac76ca91324b811e99d10e51e021703c3c1445db8a603aa",
          "signature": "fn handleToolsCall(self: *McpServer, a: std.mem.Allocator, req: JsonRpcRequest) -> []const u8",
          "params": [
            { "name": "self", "type": "*McpServer" },
            { "name": "a", "type": "std.mem.Allocator" },
            { "name": "req", "type": "JsonRpcRequest" }
          ],
          "returns": "[]const u8",
          "is_pub": false,
          "line": 193
        }
    ,    {
          "type": "fn_private",
          "name": "toolCoralQuery",
          "match_hash": "1b4b2fe581b67ae47a0c08ded6ff22af8f7247f02068e3921a18b8a4cef4468b",
          "signature": "fn toolCoralQuery(self: *McpServer, a: std.mem.Allocator, req: JsonRpcRequest, args: std.json.ObjectMap) -> []const u8",
          "params": [
            { "name": "self", "type": "*McpServer" },
            { "name": "a", "type": "std.mem.Allocator" },
            { "name": "req", "type": "JsonRpcRequest" },
            { "name": "args", "type": "std.json.ObjectMap" }
          ],
          "returns": "[]const u8",
          "is_pub": false,
          "line": 227
        }
    ,    {
          "type": "fn_private",
          "name": "toolCoralInsertNode",
          "match_hash": "97ab32862b504ce0128c571794cf46c7aadf710f037795404c46b017bdd86d9f",
          "signature": "fn toolCoralInsertNode(self: *McpServer, a: std.mem.Allocator, req: JsonRpcRequest, args: std.json.ObjectMap) -> []const u8",
          "params": [
            { "name": "self", "type": "*McpServer" },
            { "name": "a", "type": "std.mem.Allocator" },
            { "name": "req", "type": "JsonRpcRequest" },
            { "name": "args", "type": "std.json.ObjectMap" }
          ],
          "returns": "[]const u8",
          "is_pub": false,
          "line": 255
        }
    ,    {
          "type": "fn_private",
          "name": "toolCoralExplain",
          "match_hash": "ce5d72151990d7de8b81dfc891fcc74e5b4776c93959222c4ab0e8b085d3c181",
          "signature": "fn toolCoralExplain(self: *McpServer, a: std.mem.Allocator, req: JsonRpcRequest, args: std.json.ObjectMap) -> []const u8",
          "params": [
            { "name": "self", "type": "*McpServer" },
            { "name": "a", "type": "std.mem.Allocator" },
            { "name": "req", "type": "JsonRpcRequest" },
            { "name": "args", "type": "std.json.ObjectMap" }
          ],
          "returns": "[]const u8",
          "is_pub": false,
          "line": 294
        }
    ,    {
          "type": "fn_private",
          "name": "errorResponse",
          "match_hash": "05c74c7a681c58023d43b454b1617b5fe11d770afd99a167540975e0c86ca6c0",
          "signature": "fn errorResponse(self: *McpServer, id: ?std.json.Value, code: i32, message: []const u8, err: anyerror) -> []const u8",
          "params": [
            { "name": "self", "type": "*McpServer" },
            { "name": "id", "type": "?std.json.Value" },
            { "name": "code", "type": "i32" },
            { "name": "message", "type": "[]const u8" },
            { "name": "err", "type": "anyerror" }
          ],
          "returns": "[]const u8",
          "is_pub": false,
          "line": 366
        }
    ,    {
          "type": "fn_private",
          "name": "idToJson",
          "match_hash": "e76b709694d30d4a2e59e50d958e3cc633abacb055e82a4578b81666fbaabbe8",
          "signature": "fn idToJson(allocator: std.mem.Allocator, id: ?std.json.Value) -> []const u8",
          "params": [
            { "name": "allocator", "type": "std.mem.Allocator" },
            { "name": "id", "type": "?std.json.Value" }
          ],
          "returns": "[]const u8",
          "is_pub": false,
          "line": 380
        }
      ],
      "line": 66
    },
    {
      "type": "fn_private",
      "name": "parseJsonRpc",
      "match_hash": "3d37f747bfee38de24999c9f9494df5af5e9a99587a518cdce03ba0da3133baf",
      "signature": "fn parseJsonRpc(allocator: std.mem.Allocator, raw: []const u8) -> JsonRpcRequest",
      "params": [
        { "name": "allocator", "type": "std.mem.Allocator" },
        { "name": "raw", "type": "[]const u8" }
      ],
      "returns": "JsonRpcRequest",
      "is_pub": false,
      "line": 392
    },
    {
      "type": "fn_private",
      "name": "writeJsonEscaped",
      "match_hash": "8d6cb81056a6d69a7f9221cdea605965277527ebe8f956b32e1b6469c174560a",
      "signature": "fn writeJsonEscaped(writer, s: []const u8) -> void",
      "params": [
        { "name": "writer" },
        { "name": "s", "type": "[]const u8" }
      ],
      "returns": "void",
      "is_pub": false,
      "line": 417
    },
    {
      "type": "test_decl",
      "name": "McpServer: handleRequest initialize",
      "is_pub": false,
      "line": 437
    },
    {
      "type": "test_decl",
      "name": "McpServer: handleRequest tools/list",
      "is_pub": false,
      "line": 462
    },
    {
      "type": "test_decl",
      "name": "McpServer: tools/call coral_query routes to L5",
      "is_pub": false,
      "line": 488
    },
    {
      "type": "test_decl",
      "name": "McpServer: unknown method returns error -32601",
      "is_pub": false,
      "line": 515
    }
  ]
}
