{
  "meta": {
    "module": "src.reflection.binary",
    "source": "src/reflection/binary.zig",
    "language": "zig"
  },
  "capabilities": ["reflection"],
  "used_by": ["src/reflection/root.zig"],
  "members": [
    {
      "type": "struct",
      "name": "BinaryFieldCodec",
      "match_hash": "b2de0cdee08297e269b5879c25a3605139f2d991d4273fd3503abd69294a7cd9",
      "signature": "keyword_struct BinaryFieldCodec { ... }",
      "is_pub": true,
      "members": [
        {
          "type": "fn_decl",
          "name": "encodeField",
          "match_hash": "a652d2abfe55f5da157f3c2788779297bf09de59ff98e94354179c8f470cb637",
          "signature": "fn encodeField(T: type, value: T, writer) -> void",
          "params": [
            { "name": "T", "type": "type" },
            { "name": "value", "type": "T" },
            { "name": "writer" }
          ],
          "returns": "void",
          "is_pub": true,
          "line": 6
        }
    ,    {
          "type": "fn_decl",
          "name": "decodeField",
          "match_hash": "c924eb89a9d6d4124a25578a4ea9207248632216bd70cd7176734c1cab00633e",
          "signature": "fn decodeField(T: type, reader, allocator: std.mem.Allocator) -> T",
          "params": [
            { "name": "T", "type": "type" },
            { "name": "reader" },
            { "name": "allocator", "type": "std.mem.Allocator" }
          ],
          "returns": "T",
          "is_pub": true,
          "line": 34
        }
    ,    {
          "type": "fn_decl",
          "name": "fieldWireSize",
          "match_hash": "cd4dbaef51dd3c85ea41a6389ff30d31b4541b5890e6033ca0e5f414a799a323",
          "signature": "fn fieldWireSize(T: type) -> ?usize",
          "params": [
            { "name": "T", "type": "type" }
          ],
          "returns": "?usize",
          "is_pub": true,
          "line": 68
        }
      ],
      "line": 5
    }
  ]
}
