{
  "meta": {
    "module": "src.coral.common.source",
    "source": "src/coral/common/source.zig",
    "language": "zig"
  },
  "comment": "Extracts Zig source excerpts based on node type and line limits for documentation and LLM use.",
  "detail": "# Source Code Excerpt Extraction Module\n\n## Module Purpose and Architecture\n\nThis module provides intelligent source code excerpt extraction utilities optimized for AI coding assistants, documentation generation, and error message context. It centralizes the pattern of extracting relevant code snippets from Zig files while respecting semantic boundaries—ensuring functions are extracted with their complete bodies via brace matching, containers show only declarations and signatures, and other elements use line-based limits.\n\nThe architecture follows a streaming, memory-efficient design using `std.mem.splitScalar` to process source files line-by-line without loading entire files into memory. This is critical for handling large codebases efficiently.\n\n## Key Abstractions and Relationships\n\n**NodeType Enum**: The central abstraction classifying code elements into 10 categories:\n- **Functions**: `.fn_decl`, `.fn_private` — Complete body extraction via brace matching\n- **Methods**: `.method`, `.method_private` — Function-like with context awareness\n- **Containers**: `.struct_decl`, `.enum_decl`, `.union_decl` — Declaration-only extraction\n- **Other**: `.test_decl`, `.enum_field`, `.other` — Line-limited extraction\n\n**Helper Methods**: \n- `isFunction()` / `isContainer()` enable polymorphic behavior through the enum itself\n- `fromString()` provides string-to-NodeType conversion for serialization/deserialization\n\n## Public API and Usage Patterns\n\n### extractExcerpt()\n```zig\nextractExcerpt(allocator, src, start_line, node_type, max_lines) -> []const u8\n```\n\n**Parameters:**\n- `allocator`: Memory allocation strategy (required Zig convention)\n- `src`: Source file content as UTF-8 string slice\n- `start_line`: 1-based line number where extraction begins\n- `node_type`: Determines extraction strategy (function vs container vs other)\n- `max_lines`: Hard limit for excerpt size\n\n**Behavior by Type:**\n| Node Type | Extraction Strategy |\n|-----------|---------------------|\n| Functions | Complete body via brace matching |\n| Containers | Declaration + signatures only |\n| Other | Up to max_lines from start_line |\n\n### extractSimpleExcerpt() (Implied)\nLikely a simplified variant without node type awareness, using default line-based extraction.\n\n## Important Implementation Details\n\n1. **Brace Matching Logic**: The algorithm tracks `brace_depth` globally and `scope_start_depth` per function to correctly identify function boundaries even with nested structures.\n\n2. **Scope Tracking**: Uses `started_scope` flag that activates on first `{` encountered, allowing proper filtering of nested container bodies.\n\n3. **Memory Safety**: Returns owned allocation requiring `defer lines.deinit(allocator)` — follows Zig's explicit memory management paradigm.\n\n4. **Line 1-Based Indexing**: Aligns with human-readable line numbers for debugging and error reporting.\n\n5. **Comment Filtering**: Skips separator comments (`// ---`) to clean up excerpts.\n\n6. **Default Configurable**: `DEFAULT_MAX_LINES = 200` provides sensible default for LLM context windows.\n\n## Design Patterns Used\n\n1. **Strategy Pattern**: NodeType enum acts as a strategy selector, changing extraction behavior based on code element type without conditional branching in the main loop.\n\n2. **State Machine**: The while-loop maintains multiple states (scope tracking, brace depth) with clear transitions.\n\n3. **Builder/Collector Pattern**: Uses `std.ArrayList` to accumulate lines before returning final result.\n\n4. **Fail-Fast Allocation**: Returns error types (`![]const u8`) allowing callers to handle allocation failures gracefully.",
  "keywords": ["extractExcerpt", "extractSimpleExcerpt", "NodeType", "source excerpt extraction", "brace matching", "LLM context extraction", "Zig documentation", "container declarations", "function body extraction", "code snippet generation"],
  "used_by": ["src/common/llm.zig", "src/coral/common/llm.zig"],
  "members": [
    {
      "type": "enum",
      "name": "NodeType",
      "match_hash": "58ec64885c9d7ecbc77dba8d88cad8df9f6d9e2974fddecba8e26aa75b1fd03e",
      "signature": "keyword_enum NodeType { ... }",
      "comment": "Node type classification for excerpt extraction.",
      "is_pub": true,
      "members": [
        {
          "type": "enum_field",
          "name": "fn_decl",
          "is_pub": false,
          "line": 12
        }
    ,    {
          "type": "enum_field",
          "name": "fn_private",
          "is_pub": false,
          "line": 13
        }
    ,    {
          "type": "enum_field",
          "name": "method",
          "is_pub": false,
          "line": 14
        }
    ,    {
          "type": "enum_field",
          "name": "method_private",
          "is_pub": false,
          "line": 15
        }
    ,    {
          "type": "enum_field",
          "name": "struct_decl",
          "is_pub": false,
          "line": 16
        }
    ,    {
          "type": "enum_field",
          "name": "enum_decl",
          "is_pub": false,
          "line": 17
        }
    ,    {
          "type": "enum_field",
          "name": "union_decl",
          "is_pub": false,
          "line": 18
        }
    ,    {
          "type": "enum_field",
          "name": "test_decl",
          "is_pub": false,
          "line": 19
        }
    ,    {
          "type": "enum_field",
          "name": "enum_field",
          "is_pub": false,
          "line": 20
        }
    ,    {
          "type": "enum_field",
          "name": "other",
          "is_pub": false,
          "line": 21
        }
    ,    {
          "type": "fn_decl",
          "name": "isFunction",
          "match_hash": "f8c49db20575b1ba7e2aa4071bd57997f31b28dcc7108cc319cdf4662c9e8746",
          "signature": "fn isFunction(self: NodeType) -> bool",
          "params": [
            { "name": "self", "type": "NodeType" }
          ],
          "returns": "bool",
          "is_pub": true,
          "line": 23
        }
    ,    {
          "type": "fn_decl",
          "name": "isContainer",
          "match_hash": "5ebc2c5787bf0eaa501868cd69ff280f2a7a0a12ec32eab90230e3f1ac7a664b",
          "signature": "fn isContainer(self: NodeType) -> bool",
          "params": [
            { "name": "self", "type": "NodeType" }
          ],
          "returns": "bool",
          "is_pub": true,
          "line": 28
        }
    ,    {
          "type": "fn_decl",
          "name": "fromString",
          "match_hash": "03a5e049160ec8042477c8e51548b799da682e2073138eba321eb824762a7ef1",
          "signature": "fn fromString(node_type: []const u8) -> NodeType",
          "params": [
            { "name": "node_type", "type": "[]const u8" }
          ],
          "returns": "NodeType",
          "is_pub": true,
          "line": 32
        }
      ],
      "line": 11
    },
    {
      "type": "fn_decl",
      "name": "extractExcerpt",
      "match_hash": "b517c74facf564425b90b444aa746e1b47007e54843537e13dc7427f915f97b3",
      "signature": "fn extractExcerpt(allocator: std.mem.Allocator, src: []const u8, start_line: u32, node_type: NodeType, max_lines: usize) -> []const u8",
      "params": [
        { "name": "allocator", "type": "std.mem.Allocator" },
        { "name": "src", "type": "[]const u8" },
        { "name": "start_line", "type": "u32" },
        { "name": "node_type", "type": "NodeType" },
        { "name": "max_lines", "type": "usize" }
      ],
      "returns": "[]const u8",
      "comment": "Extract a source code excerpt from `src` starting at `start_line` (1-based).",
      "is_pub": true,
      "line": 53
    },
    {
      "type": "fn_decl",
      "name": "extractSimpleExcerpt",
      "match_hash": "01c0e54a4e1516be376ec903fad6db92a4b0a9dd52e918a3b6372c2b4645e86a",
      "signature": "fn extractSimpleExcerpt(allocator: std.mem.Allocator, src_content: []const u8, start_line: usize, max_lines: usize) -> []const u8",
      "params": [
        { "name": "allocator", "type": "std.mem.Allocator" },
        { "name": "src_content", "type": "[]const u8" },
        { "name": "start_line", "type": "usize" },
        { "name": "max_lines", "type": "usize" }
      ],
      "returns": "[]const u8",
      "comment": "Extract up to `max_lines` source lines starting at `start_line` (1-based).",
      "is_pub": true,
      "line": 169
    },
    {
      "type": "test_decl",
      "name": "extractExcerpt extracts function body",
      "is_pub": false,
      "line": 226
    },
    {
      "type": "test_decl",
      "name": "extractExcerpt extracts container declaration",
      "is_pub": false,
      "line": 245
    },
    {
      "type": "test_decl",
      "name": "extractSimpleExcerpt respects line limit",
      "is_pub": false,
      "line": 265
    },
    {
      "type": "test_decl",
      "name": "NodeType.fromString",
      "is_pub": false,
      "line": 273
    },
    {
      "type": "test_decl",
      "name": "NodeType.isFunction and isContainer",
      "is_pub": false,
      "line": 279
    }
  ]
}
