{
  "meta": {
    "module": "src.coral.scrub",
    "source": "src/coral/scrub.zig",
    "language": "zig"
  },
  "keywords": ["Zig", "AI-generated comments", "comment detection", "LLM", "code quality", "syntax analysis", "pattern matching", "synthetic code", "code refactoring", "Zig module"],
  "capabilities": ["coral-ingestion", "coral-database", "coral-mcp", "coral-cache"],
  "used_by": ["src/coral/main.zig", "src/guidance/sync_engine.zig"],
  "members": [
    {
      "type": "fn_decl",
      "name": "isMalformedResponse",
      "match_hash": "d2b67f6b51085730ec0c330ee3ea585383f76dd4f94abde904fb029e25c0415e",
      "signature": "fn isMalformedResponse(text: []const u8) -> bool",
      "params": [
        { "name": "text", "type": "[]const u8" }
      ],
      "returns": "bool",
      "is_pub": true,
      "line": 20
    },
    {
      "type": "fn_decl",
      "name": "isSyntheticComment",
      "match_hash": "c77d79df2f20ec26deb56d66af4e13ef54eda66e7941b9b53a563e649b86efc0",
      "signature": "fn isSyntheticComment(comment: []const u8) -> bool",
      "params": [
        { "name": "comment", "type": "[]const u8" }
      ],
      "returns": "bool",
      "is_pub": true,
      "line": 26
    },
    {
      "type": "fn_private",
      "name": "hasBoilerplateManagesPattern",
      "match_hash": "85a9bb63a741679ccde0dc3f3c8aa7f50b03dbedc2ae61ed8da6465e642a985e",
      "signature": "fn hasBoilerplateManagesPattern(text: []const u8) -> bool",
      "params": [
        { "name": "text", "type": "[]const u8" }
      ],
      "returns": "bool",
      "is_pub": false,
      "line": 37
    },
    {
      "type": "test_decl",
      "name": "isSyntheticComment: empty and short are synthetic",
      "is_pub": false,
      "line": 61
    },
    {
      "type": "test_decl",
      "name": "isSyntheticComment: boilerplate manages pattern",
      "is_pub": false,
      "line": 67
    },
    {
      "type": "test_decl",
      "name": "isSyntheticComment: malformed responses are synthetic",
      "is_pub": false,
      "line": 73
    },
    {
      "type": "test_decl",
      "name": "isSyntheticComment: valid comments pass",
      "is_pub": false,
      "line": 79
    }
  ]
}
