{
  "meta": {
    "module": "src.guidance.comment_checker",
    "source": "src/guidance/comment_checker.zig",
    "language": "zig"
  },
  "keywords": ["Zig", "comment_checker", "comment_staleness", "comment_validation", "hash_comparison", "code_sync", "Zig_lang", "documentation", "API", "testing"],
  "capabilities": ["coral-database", "ast-indexing"],
  "used_by": ["src/guidance/comment_sync.zig"],
  "members": [
    {
      "type": "fn_decl",
      "name": "checkCommentStaleness",
      "match_hash": "37744bc224799b7a49a582d882442b485dc4058abdd6fcef231cabc10875cb6b",
      "signature": "fn checkCommentStaleness(existing_comment: []const u8, member: types.Member, source_context: []const u8) -> CheckResult",
      "params": [
        { "name": "existing_comment", "type": "[]const u8" },
        { "name": "member", "type": "types.Member" },
        { "name": "source_context", "type": "[]const u8" }
      ],
      "returns": "CheckResult",
      "is_pub": true,
      "line": 18
    },
    {
      "type": "fn_decl",
      "name": "isHashStale",
      "match_hash": "b5c72a8c04c36d5a6cfeea7b281fc127c195ce018ca623db0a7a76bd0fb43be8",
      "signature": "fn isHashStale(stored_hash: ?[]const u8, current_hash: ?[]const u8) -> bool",
      "params": [
        { "name": "stored_hash", "type": "?[]const u8" },
        { "name": "current_hash", "type": "?[]const u8" }
      ],
      "returns": "bool",
      "is_pub": true,
      "line": 45
    },
    {
      "type": "test_decl",
      "name": "checkCommentStaleness - valid comment",
      "is_pub": false,
      "line": 55
    },
    {
      "type": "test_decl",
      "name": "checkCommentStaleness - empty comment",
      "is_pub": false,
      "line": 61
    },
    {
      "type": "test_decl",
      "name": "checkCommentStaleness - leaked prompt",
      "is_pub": false,
      "line": 67
    },
    {
      "type": "test_decl",
      "name": "checkCommentStaleness - too long",
      "is_pub": false,
      "line": 73
    },
    {
      "type": "test_decl",
      "name": "isHashStale - different hashes",
      "is_pub": false,
      "line": 81
    },
    {
      "type": "test_decl",
      "name": "isHashStale - same hash",
      "is_pub": false,
      "line": 85
    },
    {
      "type": "test_decl",
      "name": "isHashStale - null hash",
      "is_pub": false,
      "line": 89
    },
    {
      "type": "test_decl",
      "name": "isHashStale triggers regeneration path",
      "is_pub": false,
      "line": 94
    }
  ]
}
