{
  "meta": {
    "module": "src.reflection.enum_registry",
    "source": "src/reflection/enum_registry.zig",
    "language": "zig"
  },
  "capabilities": ["reflection"],
  "used_by": ["src/reflection/root.zig"],
  "members": [
    {
      "type": "struct",
      "name": "EnumRegistry",
      "match_hash": "37ba26cb2d69fa511151377ada404f2c807ea6d5a4e3e55a12f4f95ffa550761",
      "signature": "keyword_struct EnumRegistry { ... }",
      "is_pub": true,
      "members": [
        {
          "type": "fn_decl",
          "name": "init",
          "match_hash": "6e5081b77fe1afdeede28da57202d255a0e932fa9193189e291887ac14943d0f",
          "signature": "fn init(allocator: std.mem.Allocator) -> EnumRegistry",
          "params": [
            { "name": "allocator", "type": "std.mem.Allocator" }
          ],
          "returns": "EnumRegistry",
          "is_pub": true,
          "line": 10
        }
    ,    {
          "type": "fn_decl",
          "name": "deinit",
          "match_hash": "5a55f0051976cd9b2a8d5efbda5b456b175db6bcf0c4b040bb243687249c8ec3",
          "signature": "fn deinit(self: *EnumRegistry, allocator: std.mem.Allocator) -> void",
          "params": [
            { "name": "self", "type": "*EnumRegistry" },
            { "name": "allocator", "type": "std.mem.Allocator" }
          ],
          "returns": "void",
          "is_pub": true,
          "line": 19
        }
    ,    {
          "type": "fn_decl",
          "name": "registerEnum",
          "match_hash": "31a4fb0c76f6c75642d7f14e8aa72cba405fb8ed367f6299d9b9b47b588f0d06",
          "signature": "fn registerEnum(self: *EnumRegistry, allocator: std.mem.Allocator, T: type) -> void",
          "params": [
            { "name": "self", "type": "*EnumRegistry" },
            { "name": "allocator", "type": "std.mem.Allocator" },
            { "name": "T", "type": "type" }
          ],
          "returns": "void",
          "is_pub": true,
          "line": 25
        }
    ,    {
          "type": "fn_decl",
          "name": "nameToValue",
          "match_hash": "b7d85b529fab86f17883e93a0ffb484cf8921681071243381305cdbcee933ed4",
          "signature": "fn nameToValue(self: *const EnumRegistry, name: []const u8) -> ?i64",
          "params": [
            { "name": "self", "type": "*const EnumRegistry" },
            { "name": "name", "type": "[]const u8" }
          ],
          "returns": "?i64",
          "is_pub": true,
          "line": 44
        }
    ,    {
          "type": "fn_decl",
          "name": "valueToName",
          "match_hash": "9810159ce17f87954e99e299dbad81a448c47a2040dbcb5e7f36dab3cf0941c4",
          "signature": "fn valueToName(self: *const EnumRegistry, value: i64) -> ?[]const u8",
          "params": [
            { "name": "self", "type": "*const EnumRegistry" },
            { "name": "value", "type": "i64" }
          ],
          "returns": "?[]const u8",
          "is_pub": true,
          "line": 49
        }
      ],
      "line": 5
    }
  ]
}
