{
  "meta": {
    "module": "src.coral.batch",
    "source": "src/coral/batch.zig",
    "language": "zig"
  },
  "capabilities": ["coral-ingestion", "coral-database", "coral-mcp", "coral-cache"],
  "used_by": ["src/coral/cli.zig"],
  "members": [
    {
      "type": "struct",
      "name": "IngestStats",
      "match_hash": "8bcd8e388b9f725f08f8f98f04c05fbf93e7b36a542194debeb870d0a3a7eda5",
      "signature": "keyword_struct IngestStats { ... }",
      "is_pub": true,
      "line": 38
    },
    {
      "type": "struct",
      "name": "BatchConfig",
      "match_hash": "a578a45013c45d342df279ff89a003aca7ebbf6d1d1e4c0d9827b08db6034d7b",
      "signature": "keyword_struct BatchConfig { ... }",
      "is_pub": true,
      "line": 58
    },
    {
      "type": "struct",
      "name": "BatchIngestor",
      "match_hash": "cda66af527c27665cf5ee5c7256ea1391e4ab7876337e2c5af22f9d1ad51c7ad",
      "signature": "keyword_struct BatchIngestor { ... }",
      "is_pub": true,
      "members": [
        {
          "type": "fn_decl",
          "name": "init",
          "match_hash": "f3233a1a4b5a4f82e609e737474663c4c5c4db97fb223180b42e254df7fd454d",
          "signature": "fn init(allocator: std.mem.Allocator, config: BatchConfig) -> BatchIngestor",
          "params": [
            { "name": "allocator", "type": "std.mem.Allocator" },
            { "name": "config", "type": "BatchConfig" }
          ],
          "returns": "BatchIngestor",
          "is_pub": true,
          "line": 79
        }
    ,    {
          "type": "fn_decl",
          "name": "from",
          "match_hash": "a04cf463bfe8e81cce0274ff3e4583d99d0aac7d44c90061e00240dab8ae3526",
          "signature": "fn from(allocator: std.mem.Allocator, library: *Library) -> IngestBuilder",
          "params": [
            { "name": "allocator", "type": "std.mem.Allocator" },
            { "name": "library", "type": "*Library" }
          ],
          "returns": "IngestBuilder",
          "is_pub": true,
          "line": 90
        }
    ,    {
          "type": "fn_private",
          "name": "flushBatch",
          "match_hash": "f69c6d80ed9dac078eeebd12d8022cfc5ea7465ba7d87a377cad2cb975630109",
          "signature": "fn flushBatch(self: *BatchIngestor, mapper: *TripleMapper, library: *Library, stats: *IngestStats) -> void",
          "params": [
            { "name": "self", "type": "*BatchIngestor" },
            { "name": "mapper", "type": "*TripleMapper" },
            { "name": "library", "type": "*Library" },
            { "name": "stats", "type": "*IngestStats" }
          ],
          "returns": "void",
          "is_pub": false,
          "line": 98
        }
    ,    {
          "type": "fn_private",
          "name": "resetMapper",
          "match_hash": "c473a5b5ad053e6e66d4c0633194ab9d737c74902c1572d1cd515a4f7cad6597",
          "signature": "fn resetMapper(self: *BatchIngestor, mapper: *TripleMapper, batch_arena: *std.heap.ArenaAllocator) -> void",
          "params": [
            { "name": "self", "type": "*BatchIngestor" },
            { "name": "mapper", "type": "*TripleMapper" },
            { "name": "batch_arena", "type": "*std.heap.ArenaAllocator" }
          ],
          "returns": "void",
          "is_pub": false,
          "line": 115
        }
    ,    {
          "type": "fn_decl",
          "name": "ingestSource",
          "match_hash": "5c16e84f547f61a026e975446e7d8e7a5fa658712a2f6972b59841fa5fa5561e",
          "signature": "fn ingestSource(self: *BatchIngestor, source: []const u8, library: *Library) -> IngestStats",
          "params": [
            { "name": "self", "type": "*BatchIngestor" },
            { "name": "source", "type": "[]const u8" },
            { "name": "library", "type": "*Library" }
          ],
          "returns": "IngestStats",
          "is_pub": true,
          "line": 124
        }
    ,    {
          "type": "fn_decl",
          "name": "ingestFile",
          "match_hash": "4ef4a5e8ba552c8cb6786ce8ef9f9910af2518679e2f6a3b4060acf14fd797db",
          "signature": "fn ingestFile(self: *BatchIngestor, path: []const u8, library: *Library) -> IngestStats",
          "params": [
            { "name": "self", "type": "*BatchIngestor" },
            { "name": "path", "type": "[]const u8" },
            { "name": "library", "type": "*Library" }
          ],
          "returns": "IngestStats",
          "is_pub": true,
          "line": 178
        }
      ],
      "line": 75
    },
    {
      "type": "struct",
      "name": "IngestBuilder",
      "match_hash": "973075c19cdb42f92ba2af6241e01f44af07f8830972fc8632a11b50dd1ef729",
      "signature": "keyword_struct IngestBuilder { ... }",
      "is_pub": true,
      "members": [
        {
          "type": "fn_decl",
          "name": "batchSize",
          "match_hash": "6f419f3631210f0f0d817cb5e6e67a1763147d02c26333deafd57a7c993d7899",
          "signature": "fn batchSize(self: *IngestBuilder, n: usize) -> *IngestBuilder",
          "params": [
            { "name": "self", "type": "*IngestBuilder" },
            { "name": "n", "type": "usize" }
          ],
          "returns": "*IngestBuilder",
          "is_pub": true,
          "line": 209
        }
    ,    {
          "type": "fn_decl",
          "name": "skipErrors",
          "match_hash": "b94941f9c7855fbdfa146692284c6481c1bec89e91cc93e990bdca9a596c1195",
          "signature": "fn skipErrors(self: *IngestBuilder, v: bool) -> *IngestBuilder",
          "params": [
            { "name": "self", "type": "*IngestBuilder" },
            { "name": "v", "type": "bool" }
          ],
          "returns": "*IngestBuilder",
          "is_pub": true,
          "line": 215
        }
    ,    {
          "type": "fn_decl",
          "name": "maxTriples",
          "match_hash": "da78a52806942b8173c85b0e6c08523eae9eec5adfc796551723f8f85629d909",
          "signature": "fn maxTriples(self: *IngestBuilder, n: usize) -> *IngestBuilder",
          "params": [
            { "name": "self", "type": "*IngestBuilder" },
            { "name": "n", "type": "usize" }
          ],
          "returns": "*IngestBuilder",
          "is_pub": true,
          "line": 221
        }
    ,    {
          "type": "fn_decl",
          "name": "filter",
          "match_hash": "46241cca09ec959f953392ddf1e9bc7d456fb33785d8e2e0eb432b197ed2efb1",
          "signature": "fn filter(self: *IngestBuilder, f: FilterFn) -> *IngestBuilder",
          "params": [
            { "name": "self", "type": "*IngestBuilder" },
            { "name": "f", "type": "FilterFn" }
          ],
          "returns": "*IngestBuilder",
          "is_pub": true,
          "line": 227
        }
    ,    {
          "type": "fn_decl",
          "name": "onProgress",
          "match_hash": "c1a7e12eacb88a6e0245bc727092b52231e76e95e36457dfd5e4fae6e45b9d4f",
          "signature": "fn onProgress(self: *IngestBuilder, cb: ProgressCallback) -> *IngestBuilder",
          "params": [
            { "name": "self", "type": "*IngestBuilder" },
            { "name": "cb", "type": "ProgressCallback" }
          ],
          "returns": "*IngestBuilder",
          "is_pub": true,
          "line": 233
        }
    ,    {
          "type": "fn_decl",
          "name": "ingestSource",
          "match_hash": "04b897100e5d4026ef9964c2601ea66a15547ed637129fb911740de00364f596",
          "signature": "fn ingestSource(self: *IngestBuilder, source: []const u8) -> IngestStats",
          "params": [
            { "name": "self", "type": "*IngestBuilder" },
            { "name": "source", "type": "[]const u8" }
          ],
          "returns": "IngestStats",
          "is_pub": true,
          "line": 239
        }
    ,    {
          "type": "fn_decl",
          "name": "ingestFile",
          "match_hash": "f30cc0ec98f6621740c197d8d76bdcef45dc66e5c1d84d3431ccd58ca98589bf",
          "signature": "fn ingestFile(self: *IngestBuilder, path: []const u8) -> IngestStats",
          "params": [
            { "name": "self", "type": "*IngestBuilder" },
            { "name": "path", "type": "[]const u8" }
          ],
          "returns": "IngestStats",
          "is_pub": true,
          "line": 245
        }
      ],
      "line": 203
    },
    {
      "type": "test_decl",
      "name": "batch ingestor accumulates triples without flush",
      "is_pub": false,
      "line": 257
    },
    {
      "type": "test_decl",
      "name": "batch boundary: small batch_size flushes multiple times",
      "is_pub": false,
      "line": 281
    },
    {
      "type": "test_decl",
      "name": "progress callback invoked",
      "is_pub": false,
      "line": 301
    },
    {
      "type": "test_decl",
      "name": "batch config defaults",
      "is_pub": false,
      "line": 317
    },
    {
      "type": "test_decl",
      "name": "max_triples: stops after limit",
      "is_pub": false,
      "line": 325
    },
    {
      "type": "test_decl",
      "name": "ingest stats zero on init",
      "is_pub": false,
      "line": 353
    },
    {
      "type": "test_decl",
      "name": "end-to-end: ingestSource on YAGO sample returns nodes and edges",
      "is_pub": false,
      "line": 370
    },
    {
      "type": "test_decl",
      "name": "end-to-end: ingestFile on YAGO tiny succeeds (max 100 triples)",
      "is_pub": false,
      "line": 402
    }
  ]
}
